{
  "losses_disclosed": [
    "Only 3 tool turn(s) were observed; this is a schema example, not a workload distribution.",
    "The ledger emitted no expand record; expand materialization cost is measured from the captured MCP result with the same tokenizer."
  ],
  "methodology": {
    "boot_envelope": "canonical JSON of the MCP initialize result; charged once on turn 1",
    "model_facing_total": "sum of the four disjoint cost_buckets; prevented tokens are not counted as cost",
    "prevented_read_metric": "ledger token_mass.prevented_tokens is retained per turn and never presented as observed cost",
    "tokenizer": "exact Python port of tokenzero_core::count_tokens",
    "tool_result": "ledger token_mass.visible_tokens; an unledgered captured MCP result is tokenized identically and labeled mcp_capture",
    "tool_schema": "canonical JSON of the MCP tools/list result.tools array; charged once on turn 1"
  },
  "sample": {
    "ignored_schema_records_n": 0,
    "malformed_records_n": 0,
    "turns_n": 3
  },
  "schema": "tokenzero.observatory.v1",
  "session": {
    "agent": "session-observatory-replay",
    "repo": "/var/folders/tw/wpjfrh5s60j_yldw1nv2k4300000gn/T/tokenzero-observatory-ujmxw8tj",
    "session_id": "tz-62295-18c15e9637ea62c0",
    "version": {
      "crate": "1.2.0",
      "git_describe": null
    }
  },
  "source": {
    "capture": {
      "binary": "target/debug/tokenzero",
      "binary_mtime_ns": 1783809761333692587,
      "binary_version": "tokenzero 1.2.0",
      "boot_envelope_tokens": 155,
      "environment": {
        "machine": "arm64",
        "os": "macOS-26.5-arm64-arm-64bit-Mach-O",
        "python": "3.14.6"
      },
      "kind": "prebuilt-mcp-stdio-replay",
      "protocol_version": "2024-11-05",
      "tool_calls": [
        "tz_read",
        "tz_find",
        "tz_expand"
      ],
      "tool_schema_tokens": 5087,
      "tool_schemas_n": 36,
      "unledgered_tool_results": [
        {
          "tool": "tz_expand",
          "visible_tokens": 53
        }
      ]
    },
    "ledger": "/Users/aditya/AI/TokenZero/crates/tokenzero-mcp/benches/session_observatory/replayed.ledger.jsonl",
    "ledger_sha256": "fedbbf8054269505530b598c3c579b22b37ed73c865d482358c79b3d1cde6c94"
  },
  "totals": {
    "boot_envelope_tokens": 155,
    "expand_materialization_tokens": 53,
    "model_facing_total_tokens": 5718,
    "tool_result_tokens": 423,
    "tool_result_visible_tokens": 476,
    "tool_schema_tokens": 5087
  },
  "turns": [
    {
      "accounting_source": "tokenzero.ledger.v1",
      "cost_buckets": {
        "boot_envelope_tokens": 155,
        "expand_materialization_tokens": 0,
        "tool_result_tokens": 256,
        "tool_schema_tokens": 5087
      },
      "cumulative_session_cost_tokens": 256,
      "ledger_token_mass": {
        "prevented_tokens": 0,
        "raw_tokens": 256,
        "saved_bytes": 0,
        "visible_tokens": 256
      },
      "model_facing_total_tokens": 5498,
      "optimization_tags": [
        "session_dedup:on",
        "diff_reads:on",
        "tool_surface:mcp"
      ],
      "timestamp_ms": 1783810926799,
      "tool": "read",
      "tool_result_visible_tokens": 256,
      "turn_index": 1
    },
    {
      "accounting_source": "tokenzero.ledger.v1",
      "cost_buckets": {
        "boot_envelope_tokens": 0,
        "expand_materialization_tokens": 0,
        "tool_result_tokens": 167,
        "tool_schema_tokens": 0
      },
      "cumulative_session_cost_tokens": 423,
      "ledger_token_mass": {
        "prevented_tokens": 0,
        "raw_tokens": 540,
        "saved_bytes": 0,
        "visible_tokens": 167
      },
      "model_facing_total_tokens": 167,
      "optimization_tags": [
        "session_dedup:on",
        "diff_reads:on",
        "tool_surface:mcp"
      ],
      "timestamp_ms": 1783810926810,
      "tool": "find",
      "tool_result_visible_tokens": 167,
      "turn_index": 2
    },
    {
      "accounting_source": "mcp_capture",
      "cost_buckets": {
        "boot_envelope_tokens": 0,
        "expand_materialization_tokens": 53,
        "tool_result_tokens": 0,
        "tool_schema_tokens": 0
      },
      "cumulative_session_cost_tokens": 423,
      "ledger_token_mass": null,
      "model_facing_total_tokens": 53,
      "optimization_tags": [],
      "timestamp_ms": 1783810926812,
      "tool": "expand",
      "tool_result_visible_tokens": 53,
      "turn_index": 3
    }
  ]
}
